{
  "weapon_platforms": [
    "W01",
    "W02",
    "W03",
    "W04",
    "W05",
    "W06",
    "W07",
    "W08",
    "W09",
    "W10",
    "W11",
    "W12"
  ],
  "sensor_platforms": [
    "S01",
    "S02",
    "S03",
    "S04",
    "S05",
    "S06",
    "S07"
  ],
  "targets": [
    "T01",
    "T02",
    "T03",
    "T04",
    "T05",
    "T06",
    "T07",
    "T08"
  ],
  "weapon_target_destruction_probability": {
    "W01": {
      "T01": 0.43,
      "T02": 0.46,
      "T03": 0.49,
      "T04": 0.52,
      "T05": 0.55,
      "T06": 0.58,
      "T07": 0.61,
      "T08": 0.34
    },
    "W02": {
      "T01": 0.49,
      "T02": 0.52,
      "T03": 0.55,
      "T04": 0.58,
      "T05": 0.61,
      "T06": 0.34,
      "T07": 0.37,
      "T08": 0.4
    },
    "W03": {
      "T01": 0.55,
      "T02": 0.58,
      "T03": 0.61,
      "T04": 0.34,
      "T05": 0.37,
      "T06": 0.4,
      "T07": 0.43,
      "T08": 0.46
    },
    "W04": {
      "T01": 0.61,
      "T02": 0.34,
      "T03": 0.37,
      "T04": 0.4,
      "T05": 0.43,
      "T06": 0.46,
      "T07": 0.49,
      "T08": 0.52
    },
    "W05": {
      "T01": 0.37,
      "T02": 0.4,
      "T03": 0.43,
      "T04": 0.46,
      "T05": 0.49,
      "T06": 0.52,
      "T07": 0.55,
      "T08": 0.58
    },
    "W06": {
      "T01": 0.43,
      "T02": 0.46,
      "T03": 0.49,
      "T04": 0.52,
      "T05": 0.55,
      "T06": 0.58,
      "T07": 0.61,
      "T08": 0.34
    },
    "W07": {
      "T01": 0.49,
      "T02": 0.52,
      "T03": 0.55,
      "T04": 0.58,
      "T05": 0.61,
      "T06": 0.34,
      "T07": 0.37,
      "T08": 0.4
    },
    "W08": {
      "T01": 0.55,
      "T02": 0.58,
      "T03": 0.61,
      "T04": 0.34,
      "T05": 0.37,
      "T06": 0.4,
      "T07": 0.43,
      "T08": 0.46
    },
    "W09": {
      "T01": 0.61,
      "T02": 0.34,
      "T03": 0.37,
      "T04": 0.4,
      "T05": 0.43,
      "T06": 0.46,
      "T07": 0.49,
      "T08": 0.52
    },
    "W10": {
      "T01": 0.37,
      "T02": 0.4,
      "T03": 0.43,
      "T04": 0.46,
      "T05": 0.49,
      "T06": 0.52,
      "T07": 0.55,
      "T08": 0.58
    },
    "W11": {
      "T01": 0.43,
      "T02": 0.46,
      "T03": 0.49,
      "T04": 0.52,
      "T05": 0.55,
      "T06": 0.58,
      "T07": 0.61,
      "T08": 0.34
    },
    "W12": {
      "T01": 0.49,
      "T02": 0.52,
      "T03": 0.55,
      "T04": 0.58,
      "T05": 0.61,
      "T06": 0.34,
      "T07": 0.37,
      "T08": 0.4
    }
  },
  "sensor_target_tracking_probability": {
    "S01": {
      "T01": 0.555,
      "T02": 0.605,
      "T03": 0.655,
      "T04": 0.705,
      "T05": 0.505,
      "T06": 0.555,
      "T07": 0.605,
      "T08": 0.655
    },
    "S02": {
      "T01": 0.58,
      "T02": 0.63,
      "T03": 0.68,
      "T04": 0.48,
      "T05": 0.53,
      "T06": 0.58,
      "T07": 0.63,
      "T08": 0.68
    },
    "S03": {
      "T01": 0.605,
      "T02": 0.655,
      "T03": 0.705,
      "T04": 0.505,
      "T05": 0.555,
      "T06": 0.605,
      "T07": 0.655,
      "T08": 0.705
    },
    "S04": {
      "T01": 0.63,
      "T02": 0.68,
      "T03": 0.48,
      "T04": 0.53,
      "T05": 0.58,
      "T06": 0.63,
      "T07": 0.68,
      "T08": 0.48
    },
    "S05": {
      "T01": 0.655,
      "T02": 0.705,
      "T03": 0.505,
      "T04": 0.555,
      "T05": 0.605,
      "T06": 0.655,
      "T07": 0.705,
      "T08": 0.505
    },
    "S06": {
      "T01": 0.68,
      "T02": 0.48,
      "T03": 0.53,
      "T04": 0.58,
      "T05": 0.63,
      "T06": 0.68,
      "T07": 0.48,
      "T08": 0.53
    },
    "S07": {
      "T01": 0.705,
      "T02": 0.505,
      "T03": 0.555,
      "T04": 0.605,
      "T05": 0.655,
      "T06": 0.705,
      "T07": 0.505,
      "T08": 0.555
    }
  },
  "target_threat_value": {
    "T01": 21,
    "T02": 24,
    "T03": 27,
    "T04": 30,
    "T05": 33,
    "T06": 36,
    "T07": 39,
    "T08": 42
  },
  "weapon_usage_cost": {
    "W01": 5,
    "W02": 6,
    "W03": 7,
    "W04": 4,
    "W05": 5,
    "W06": 6,
    "W07": 7,
    "W08": 4,
    "W09": 5,
    "W10": 6,
    "W11": 7,
    "W12": 4
  },
  "sensor_activation_cost": {
    "S01": 3,
    "S02": 4,
    "S03": 2,
    "S04": 3,
    "S05": 4,
    "S06": 2,
    "S07": 3
  },
  "total_ammunition_baseline": 60,
  "sensor_capacity": {
    "S01": 2,
    "S02": 1,
    "S03": 2,
    "S04": 1,
    "S05": 2,
    "S06": 1,
    "S07": 2
  }
}
